{
  "schema_version": "1.0.0",
  "case_id": "PED-010",
  "title": "Paciente de 6 años con cuadro de pediatría",
  "specialty": "pediatria",
  "language": "es",
  "status": "curado",
  "source": {
    "dataset": "MedQA",
    "item_id": "medqa-5fc375051c4a68f2",
    "license": "MIT",
    "method": "ia_validador"
  },
  "public": {
    "patient": {
      "alias": "Paciente 10",
      "age_years": 6,
      "sex": "femenino"
    },
    "chief_complaint": {
      "evidence_id": "PED-010.motivo.queja_principal",
      "category": "motivo",
      "label": "Motivo de consulta",
      "text": "Fractura de brazo."
    },
    "items": [
      {
        "evidence_id": "PED-010.anamnesis.llegada",
        "category": "anamnesis",
        "label": "Datos de ingreso",
        "text": "Niña de 6 años hospitalizada por una fractura de brazo."
      }
    ],
    "allergies_recorded": false
  },
  "on_request": [
    {
      "evidence_id": "PED-010.examen.exploracion_fisica",
      "category": "examen_fisico",
      "label": "Exploración física",
      "text": "En la revisión física se encuentran desarrollo mamario y manchas café con leche en la piel.",
      "reveal_policy": {
        "owner": "medico_asistente",
        "mode": "al_examinar",
        "requires": [
          "exploracion_fisica"
        ]
      }
    },
    {
      "evidence_id": "PED-010.lab.funcion_tiroidea",
      "category": "laboratorio",
      "label": "Función tiroidea",
      "text": "La fuente describe a la vez hipotiroidismo e hipertiroidismo, sin más detalle.",
      "interpretation": "A",
      "reveal_policy": {
        "owner": "laboratorio",
        "mode": "al_solicitar_examen",
        "requires": [
          "funcion_tiroidea"
        ]
      }
    },
    {
      "evidence_id": "PED-010.imagen.imagen_osea",
      "category": "imagen",
      "label": "Estudio de imagen ósea",
      "text": "Muestra crecimiento fibroso del hueso (displasia fibrosa); la edad ósea se interpreta como de 9 años.",
      "interpretation": "A",
      "reveal_policy": {
        "owner": "radiologia",
        "mode": "al_solicitar_examen",
        "requires": [
          "imagen_osea"
        ]
      }
    }
  ],
  "protected": {
    "diagnosis": {
      "name": "Síndrome de McCune-Albright",
      "synonyms": [
        "Síndrome de McCune-Albright"
      ]
    },
    "differentials": [
      {
        "name": "Neurofibromatosis tipo 1",
        "must_not_miss": false,
        "discard_evidence_ids": []
      },
      {
        "name": "Síndrome de Peutz-Jeghers",
        "must_not_miss": false,
        "discard_evidence_ids": []
      },
      {
        "name": "Displasia fibrosa ósea no sindrómica",
        "must_not_miss": false,
        "discard_evidence_ids": []
      },
      {
        "name": "Otras causas de pubertad precoz periférica",
        "must_not_miss": true,
        "discard_evidence_ids": []
      }
    ],
    "treatment_reference": {
      "summary": "Los hallazgos descritos apoyan síndrome de McCune-Albright, pero el texto fuente es ambiguo sobre la función tiroidea y no aporta resultados hormonales completos. No se establece tratamiento individual; requiere evaluación endocrina y esquelética pediátrica.",
      "key_actions": [
        "Aclarar y confirmar la función tiroidea; no asumir que la paciente tiene simultáneamente hipotiroidismo e hipertiroidismo.",
        "Coordinar seguimiento por endocrinología pediátrica y ortopedia según extensión ósea y manifestaciones."
      ]
    },
    "contraindications": [],
    "evaluation": {
      "key_questions": [
        {
          "id": "kq1",
          "topic": "Traducción al español: Niña de 6 años hospitalizada por una fractura de brazo; en la revisión física se encuentran desarrollo mamario, manchas café con leche en la piel, hipotiroidismo e hipertiroidismo, y el estudio de imagen ósea muestra crecimiento fibroso (displasia fibrosa); la edad ósea se interpreta como de 9 años. ¿Cuál es el diagnóstico más probable? Opciones traducidas: Síndrome de Fanconi; Síndrome de McCune-Albright; Neurofibromatosis; Síndrome de Peutz-Jeghers. Respuesta fuente: B — McCune-Albright syndrome. Texto fuente conservado (inglés): A 6-year-old girl was hospitalized with a broken arm, body checkups have been found in breast development, skin showing cafe au lait spots (café-au-lait spots), hypothyroidism, hyperthyroidism also the phenomenon of poor bone imaging examination showed fibrous growth ( fibrous dysplasia), the interpretation of bone age was 9 years old, the most likely diagnosis is: Opciones fuente: Fanconi syndrome; McCune-Albright syndrome; neurofibromatosis; Peutz-Jeghers syndrome",
          "evidence_ids": [
            "PED-010.motivo.queja_principal"
          ],
          "weight": 3,
          "critical": true,
          "error_if_missing": "razonamiento_clinico"
        },
        {
          "id": "kq2",
          "topic": "Exploración física: desarrollo mamario y manchas café con leche",
          "evidence_ids": [
            "PED-010.examen.exploracion_fisica"
          ],
          "weight": 5,
          "critical": true,
          "error_if_missing": "razonamiento_clinico"
        },
        {
          "id": "kq3",
          "topic": "Estudio de imagen ósea: displasia fibrosa y edad ósea adelantada",
          "evidence_ids": [
            "PED-010.imagen.imagen_osea"
          ],
          "weight": 4,
          "critical": true,
          "error_if_missing": "razonamiento_clinico"
        },
        {
          "id": "kq4",
          "topic": "Función tiroidea",
          "evidence_ids": [
            "PED-010.lab.funcion_tiroidea"
          ],
          "weight": 3,
          "critical": false,
          "error_if_missing": "razonamiento_clinico"
        }
      ],
      "tests": {
        "recommended": [
          "valoracion_endocrinologia_pediatrica",
          "funcion_tiroidea_para_aclarar_enunciado_fuente",
          "revisar_imagenes_y_extension_de_displasia_fibrosa"
        ],
        "optional": [
          "evaluacion_endocrina_de_pubertad_precoz",
          "seguimiento_esqueletico_segun_especialista"
        ],
        "unnecessary": []
      }
    }
  },
  "provenance": {
    "created_by": "case_preparation.transform.medqa_final_review",
    "created_at": "2026-10-08",
    "validator_version": "1.0.0",
    "validated_at": "2026-10-08",
    "curated_by": "case_preparation.curation",
    "curated_at": "2026-10-08",
    "rejection_reason": null
  }
}
