{
  "schema_version": "1.0.0",
  "case_id": "CIR-005",
  "title": "Paciente de 28 años con cuadro de cirugía general",
  "specialty": "cirugia_general",
  "language": "es",
  "status": "validado",
  "source": {
    "dataset": "MedQA",
    "item_id": "medqa-4135d59786b5b7ac",
    "license": "MIT",
    "method": "ia_validador"
  },
  "public": {
    "patient": {
      "alias": "Paciente 7",
      "age_years": 28,
      "sex": "masculino"
    },
    "chief_complaint": {
      "evidence_id": "CIR-005.motivo.queja_principal",
      "category": "motivo",
      "label": "Queja principal",
      "text": "Hombre de 28 años con dolor abdominal intenso y apendicitis fue sometido a apendicectomía urgente."
    },
    "items": [
      {
        "evidence_id": "CIR-005.historia.fuente_medqa",
        "category": "anamnesis",
        "label": "Resumen clínico (adaptado de MedQA)",
        "text": "Hombre de 28 años con dolor abdominal intenso y apendicitis fue sometido a apendicectomía urgente. Durante la intervención presentó hemorragia persistente que requirió transfusión. Antes de la cirugía tenía tiempo de sangrado, tiempo de protrombina/INR y recuento plaquetario normales; después se encontró TTPa prolongado y refirió antecedente familiar de trastorno hemorrágico."
      }
    ],
    "allergies_recorded": false
  },
  "on_request": [
    {
      "evidence_id": "CIR-005.solicitud.exploracion_fisica",
      "category": "examen_fisico",
      "label": "Exploración física",
      "text": "Los hallazgos de exploración física descritos por la fuente ya están incluidos en la historia pública; no se documentan otros hallazgos para revelar.",
      "reveal_policy": {
        "owner": "medico_asistente",
        "mode": "al_preguntar",
        "requires": [
          "exploracion_fisica"
        ]
      }
    }
  ],
  "protected": {
    "diagnosis": {
      "name": "Hemofilia A",
      "synonyms": [
        "Hemofilia A"
      ]
    },
    "differentials": [
      {
        "name": "Hemofilia B",
        "must_not_miss": false,
        "discard_evidence_ids": []
      },
      {
        "name": "Enfermedad de von Willebrand",
        "must_not_miss": false,
        "discard_evidence_ids": []
      },
      {
        "name": "Inhibidor adquirido de factor VIII",
        "must_not_miss": true,
        "discard_evidence_ids": []
      },
      {
        "name": "Coagulopatía perioperatoria adquirida",
        "must_not_miss": true,
        "discard_evidence_ids": []
      }
    ],
    "treatment_reference": {
      "summary": "El sangrado activo con posible hemofilia requiere control hemostático urgente con hematología. El producto depende de factor deficiente, inhibidores y situación clínica; la fuente no permite elegir producto ni dosis.",
      "key_actions": [
        "No retrasar consulta de hematología ante sangrado quirúrgico persistente.",
        "Confirmar actividad de factor VIII/IX y descartar inhibidor antes de etiquetar hemofilia A."
      ]
    },
    "contraindications": [],
    "evaluation": {
      "key_questions": [
        {
          "id": "kq1",
          "topic": "Traducción al español: Hombre de 28 años con apendicitis se somete a apendicectomía urgente y presenta sangrado persistente que requiere transfusión. Antes de la cirugía tenía tiempo de sangrado, tiempo de protrombina/INR y recuento plaquetario normales; después se detecta TTPa prolongado y refiere antecedentes familiares de un trastorno hemorrágico. ¿Cuál es el diagnóstico más probable? Opciones traducidas: Hemofilia A; Síndrome de Bernard-Soulier; Trombastenia de Glanzmann; Púrpura trombótica trombocitopénica; Enfermedad de von Willebrand. Respuesta fuente: A — Hemophilia A. Texto fuente conservado (inglés): A 28-year-old man presents for severe abdominal pain and is diagnosed with appendicitis. He is taken for emergent appendectomy. During the procedure, the patient has massive and persistent bleeding requiring a blood transfusion. The preoperative laboratory studies showed a normal bleeding time, normal prothrombin time (PT), an INR of 1.0, and a normal platelet count. Postoperatively, when the patient is told about the complications during the surgery, he recalls that he forgot to mention that he has a family history of an unknown bleeding disorder. The postoperative laboratory tests reveal a prolonged partial thromboplastin time (PTT). Which of the following is the most likely diagnosis in this patient? Opciones fuente: Hemophilia A; Bernard-Soulier syndrome; Glanzman syndrome; Thrombotic thrombocytopenic purpura; von Willebrand disease",
          "evidence_ids": [
            "CIR-005.historia.fuente_medqa"
          ],
          "weight": 3,
          "critical": true,
          "error_if_missing": "razonamiento_clinico"
        }
      ],
      "tests": {
        "recommended": [
          "actividad_de_factor_viii_y_factor_ix",
          "estudio_de_mezcla_del_ttp",
          "valoracion_hematologia_urgente"
        ],
        "optional": [
          "antigeno_y_actividad_del_factor_de_von_willebrand"
        ],
        "unnecessary": []
      }
    }
  },
  "provenance": {
    "created_by": "case_preparation.transform.medqa_final_review",
    "created_at": "2026-10-08",
    "validator_version": "1.0.0",
    "validated_at": "2026-10-08",
    "curated_by": null,
    "curated_at": null,
    "rejection_reason": null
  }
}
